{"greedy_generation":{"do_sample":false,"eos_token_ids":[151645],"length_penalty":1.0,"max_new_tokens":32,"min_new_tokens":0,"no_repeat_ngram_size":0,"num_beams":1,"pad_token_id":151643,"repetition_penalty":1.0,"stop_strings":[],"temperature":0.0,"top_k":0,"top_p":1.0,"use_cache":true},"manifest_sha256":"a6214355c1c6b9192d435e62f3add6bef5db8c3a6c1cf3a55cb2a9dbfc91182e","model":{"artifact_files":[{"path":".gitattributes","roles":["other"],"sha256":"11ad7efa24975ee4b0c3c3a38ed18737f0658a5f75a0a96787b576a78a023361","size_bytes":1519},{"path":"LICENSE","roles":["other"],"sha256":"832dd9e00a68dd83b3c3fb9f5588dad7dcf337a0db50f7d9483f310cd292e92e","size_bytes":11343},{"path":"README.md","roles":["other"],"sha256":"b19c806a904db6dc878a0462e70b551f6b7ac78dfbb88c2eb966ca2b9109ae15","size_bytes":4917},{"path":"config.json","roles":["config"],"sha256":"18e18afcaccafade98daf13a54092927904649e1dd4eba8299ab717d5d94ff45","size_bytes":659},{"path":"generation_config.json","roles":["generation_config"],"sha256":"e558847a8b4402616f1273797b015104dc266fe4b520056fca88823ba8f8ebe6","size_bytes":242},{"path":"merges.txt","roles":["other"],"sha256":"599bab54075088774b1733fde865d5bd747cbcc7a547c5bc12610e874e26f5e3","size_bytes":1671839},{"path":"model.safetensors","roles":["weights"],"sha256":"fdf756fa7fcbe7404d5c60e26bff1a0c8b8aa1f72ced49e7dd0210fe288fb7fe","size_bytes":988097824},{"path":"tokenizer.json","roles":["tokenizer"],"sha256":"c0382117ea329cdf097041132f6d735924b697924d6f6fc3945713e96ce87539","size_bytes":7031645},{"path":"tokenizer_config.json","roles":["chat_template","tokenizer"],"sha256":"5b5d4f65d0acd3b2d56a35b56d374a36cbc1c8fa5cf3b3febbbfabf22f359583","size_bytes":7305},{"path":"vocab.json","roles":["other"],"sha256":"ca10d7e9fb3ed18575dd1e277a2579c16d108e32f27439684afa0e10b1440910","size_bytes":2776833}],"chat_template_sha256":"0013c52915912d02d611df1eb0f0ac88eb76f7489a3bd6acdbbd0ad64e4bc916","logical_model_id":"Qwen/Qwen2.5-0.5B-Instruct","model_config_sha256":"086c19d63c5e6e58152723d7c9147b3ba6e418df9bc9a0f562ea4bccf070247d","model_weights_sha256":"5e5f9f594add0fa3c0336ad387596df04ac0b1c8938aece7c5b2def319127425","quantization":{"activation_dtype":"float32","backend":"torchao","config_version":2,"granularity":"per-row","scheme":"int8-weight-only","set_inductor_config":false,"weight_dtype":"int8"},"resolved_model_convention":"transformers-pretrained-directory","tokenizer_sha256":"a63d8a3be712e9e697abb961473e379b785832d0b9fa0ea39d6fe62d61831982"},"packages":{"safetensors":"0.7.0","tokenizers":"0.22.2","torch":"2.10.0+cpu","torchao":"0.17.0","transformers":"5.0.0"},"python_version":"3.12.13","schema_version":"oczy/runtime-manifest/v2"}
